{
  "$schema": "./schema.json",
  "schemaVersion": 1,
  "id": "gruvbox-dark",
  "name": "Gruvbox Dark",
  "colorScheme": "dark",
  "order": 100,
  "extends": "dark",
  "tokens": {
    "bg": "#282828",
    "bg-soft": "#2c2a29",
    "panel": "#32302f",
    "line": "#504945",
    "line-soft": "#3c3836",
    "text": "#ebdbb2",
    "text-secondary": "#d5c4a1",
    "muted": "#bdae93",
    "text-dim": "#bdae93",
    "muted-dim": "#7c6f64",
    "ctl-edge": "#a89984",
    "sm-edge": "#a89984",
    "chrome-bg": "#32302f",
    "chrome-edge": "#504945",
    "accent": "#fabd2f",
    "accent-dim": "#fabd2f40",
    "ok": "#b8bb26",
    "warn": "#e0a15b",
    "err": "#ff7865",
    "inflight": "#d3869b",
    "node-grad": "var(--panel)",
    "burst-live-wash": "#d3869b12",
    "hero-core": "#fabd2f",
    "grid-line": "#3c3836",
    "minimap-mask": "rgba(40, 40, 40, .85)",
    "session-accent-l": "74%",
    "session-edge-idle-l": "65%",
    "cat-file": "#83a598",
    "cat-shell": "#fe8019",
    "cat-web": "#a3c7bd",
    "cat-agent": "#ebdbb2",
    "cat-task": "#b8bb26",
    "cat-plan": "#b4a5c7",
    "cat-mcp": "#8ec07c",
    "cat-other": "#bdae93",
    "usage-purple": "#d3869b",
    "usage-blue": "#83a598",
    "usage-teal": "#8ec07c",
    "usage-lime": "#b8bb26",
    "usage-pink": "#e9a4b0",
    "usage-indigo": "#b4a5c7",
    "usage-orange": "#fe8019",
    "usage-zinc": "#bdae93",
    "usage-cyan": "#a3c7bd"
  },
  "selection": {
    "background": "#504945",
    "foreground": "#fbf1c7"
  }
}
