{
  "$schema": "./schema.json",
  "schemaVersion": 1,
  "id": "white-contrast",
  "name": "White Contrast",
  "colorScheme": "light",
  "order": 80,
  "extends": "light",
  "tokens": {
    "node-grad": "var(--panel)",
    "topbar-grad": "var(--panel)",
    "bg": "#ffffff",
    "bg-soft": "#f4f4f4",
    "panel": "#ffffff",
    "line": "#686868",
    "line-soft": "#858585",
    "text": "#111111",
    "text-secondary": "#262626",
    "muted": "#404040",
    "text-dim": "#404040",
    "muted-dim": "#606060",
    "accent": "#0046a8",
    "accent-dim": "#0046a822",
    "ok": "#005f2a",
    "warn": "#843600",
    "err": "#a31621",
    "inflight": "#6712a2",
    "ctl-fill": "color-mix(in srgb, var(--text) 7%, transparent)",
    "ctl-edge": "#555555",
    "sm-edge": "#686868",
    "chrome-bg": "#ffffff",
    "chrome-edge": "#686868",
    "conn-wash": "#a3162114",
    "burst-live-wash": "#6712a20c",
    "hero-core": "#0046a8",
    "grid-line": "#dddddd",
    "minimap-mask": "rgba(255, 255, 255, .85)",
    "cat-file": "#0046a8",
    "cat-shell": "#843600",
    "cat-web": "#005b73",
    "cat-agent": "#861493",
    "cat-task": "#005f2a",
    "cat-plan": "#4c1d95",
    "cat-mcp": "#005a54",
    "cat-other": "#465466",
    "usage-purple": "#4c1d95",
    "usage-blue": "#0046a8",
    "usage-teal": "#005a54",
    "usage-lime": "#365a0a",
    "usage-pink": "#9d124c",
    "usage-indigo": "#3730a3",
    "usage-orange": "#7c2d12",
    "usage-zinc": "#404040",
    "usage-cyan": "#005b73"
  },
  "selection": {
    "background": "#0046a8",
    "foreground": "#ffffff"
  }
}
