{
  "$schema": "./schema.json",
  "schemaVersion": 1,
  "id": "gruvbox-light",
  "name": "Gruvbox Light",
  "colorScheme": "light",
  "order": 110,
  "extends": "light",
  "tokens": {
    "bg": "#f5efdc",
    "bg-soft": "#eee4cc",
    "panel": "#faf7e8",
    "line": "#c4b698",
    "line-soft": "#ded2af",
    "text": "#3c3836",
    "text-secondary": "#504945",
    "muted": "#665c54",
    "text-dim": "#665c54",
    "muted-dim": "#a89984",
    "ctl-edge": "#7c6f64",
    "sm-edge": "#7c6f64",
    "chrome-bg": "#faf7e8",
    "chrome-edge": "#bdae93",
    "accent": "#875a12",
    "accent-dim": "#875a1238",
    "ok": "#626015",
    "warn": "#85551a",
    "err": "#9d0006",
    "inflight": "#8f3f71",
    "node-grad": "var(--panel)",
    "topbar-grad": "var(--panel)",
    "shadow-1": "0 4px 14px rgba(60,56,54,0.10)",
    "shadow-2": "0 10px 24px rgba(60,56,54,0.16)",
    "shadow-contact": "0 1px 2px rgba(60,56,54,0.12)",
    "shadow-overlay": "0 16px 40px rgba(60,56,54,0.16)",
    "conn-wash": "#9d000614",
    "burst-live-wash": "#8f3f710c",
    "hero-core": "#875a12",
    "grid-line": "#e1d8bf",
    "minimap-mask": "rgba(245, 239, 220, .85)",
    "session-label-l": "24%",
    "session-accent-l": "24%",
    "session-edge-l": "28%",
    "session-edge-idle-l": "32%",
    "cat-file": "#076678",
    "cat-shell": "#af3a03",
    "cat-web": "#315e60",
    "cat-agent": "#3c3836",
    "cat-task": "#626015",
    "cat-plan": "#6f5775",
    "cat-mcp": "#366747",
    "cat-other": "#665c54",
    "usage-purple": "#8f3f71",
    "usage-blue": "#076678",
    "usage-teal": "#366747",
    "usage-lime": "#626015",
    "usage-pink": "#934653",
    "usage-indigo": "#6f5775",
    "usage-orange": "#af3a03",
    "usage-zinc": "#665c54",
    "usage-cyan": "#315e60"
  },
  "selection": {
    "background": "#d5c4a1",
    "foreground": "#3c3836"
  }
}
