{
  "$schema": "./schema.json",
  "schemaVersion": 1,
  "id": "omarchy",
  "name": "Omarchy",
  "colorScheme": "dark",
  "order": 50,
  "extends": "dark",
  "tokens": {
    "node-grad": "var(--panel)",
    "topbar-grad": "var(--panel)",
    "session-accent-l": "74%",
    "session-edge-idle-l": "65%",
    "bg": "#1a1b26",
    "bg-soft": "#1e2030",
    "panel": "#24283b",
    "line": "#414868",
    "line-soft": "#343b58",
    "text": "#c0caf5",
    "text-secondary": "#b4bee6",
    "muted": "#9aa5ce",
    "text-dim": "#9aa5ce",
    "muted-dim": "#565f89",
    "accent": "#7aa2f7",
    "accent-dim": "#7aa2f750",
    "ok": "#9ece6a",
    "warn": "#e0af68",
    "err": "#f7768e",
    "inflight": "#bb9af7",
    "chrome-bg": "#24283b",
    "chrome-edge": "#414868",
    "burst-live-wash": "#bb9af712",
    "hero-core": "#7aa2f7",
    "grid-line": "#292e42",
    "minimap-mask": "rgba(26, 27, 38, .85)",
    "cat-file": "#7aa2f7",
    "cat-shell": "#e0af68",
    "cat-web": "#7dcfff",
    "cat-agent": "#ff9ac1",
    "cat-task": "#9ece6a",
    "cat-plan": "#bb9af7",
    "cat-mcp": "#73daca",
    "cat-other": "#a9b1d6"
  },
  "selection": {
    "background": "#292e42",
    "foreground": "#c0caf5"
  }
}
