{
  "$schema": "./schema.json",
  "schemaVersion": 1,
  "id": "gruvbox-material",
  "name": "Gruvbox Material",
  "colorScheme": "dark",
  "order": 120,
  "extends": "gruvbox-dark",
  "tokens": {
    "bg": "#32302f",
    "bg-soft": "#3c3836",
    "panel": "#45403d",
    "line": "#655b54",
    "line-soft": "#534b45",
    "text": "#ddc7a1",
    "text-secondary": "#d4be98",
    "muted": "#cdbb9f",
    "text-dim": "#cdbb9f",
    "muted-dim": "#928374",
    "ctl-edge": "#b9a68e",
    "sm-edge": "#b9a68e",
    "chrome-bg": "#45403d",
    "chrome-edge": "#75695f",
    "accent": "#e7bd7b",
    "accent-dim": "#e7bd7b40",
    "ok": "#bbc783",
    "warn": "#efb581",
    "err": "#f5a69e",
    "inflight": "#e9b1c1",
    "burst-live-wash": "#e9b1c112",
    "hero-core": "#e7bd7b",
    "grid-line": "#48423d",
    "minimap-mask": "rgba(50, 48, 47, .85)",
    "cat-file": "#a3c5b9",
    "cat-shell": "#efb581",
    "cat-web": "#abc9c1",
    "cat-agent": "#ddc7a1",
    "cat-task": "#bbc783",
    "cat-plan": "#b8bfd0",
    "cat-mcp": "#a6c49d",
    "cat-other": "#cdbb9f",
    "usage-purple": "#c4bbdf",
    "usage-blue": "#a3c5b9",
    "usage-teal": "#a6c49d",
    "usage-lime": "#bbc783",
    "usage-pink": "#e4b8bf",
    "usage-indigo": "#b8bfd0",
    "usage-orange": "#efb581",
    "usage-zinc": "#cdbb9f",
    "usage-cyan": "#abc9c1"
  },
  "selection": {
    "background": "#5a524c",
    "foreground": "#ebdbb2"
  }
}
