{
  "$schema": "./schema.json",
  "schemaVersion": 1,
  "id": "catppuccin-mocha",
  "name": "Catppuccin Mocha",
  "colorScheme": "dark",
  "order": 90,
  "extends": "dark",
  "tokens": {
    "node-grad": "var(--panel)",
    "topbar-grad": "var(--panel)",
    "bg": "#1e1e2e",
    "bg-soft": "#181825",
    "panel": "#252537",
    "line": "#585b70",
    "line-soft": "#45475a",
    "text": "#cdd6f4",
    "text-secondary": "#bac2de",
    "muted": "#a6adc8",
    "text-dim": "#a6adc8",
    "muted-dim": "#7f849c",
    "accent": "#cba6f7",
    "accent-dim": "#cba6f740",
    "ok": "#a6e3a1",
    "warn": "#f9e2af",
    "err": "#f38ba8",
    "inflight": "#f5c2e7",
    "chrome-bg": "#252537",
    "chrome-edge": "#585b70",
    "burst-live-wash": "#f5c2e712",
    "hero-core": "#cba6f7",
    "grid-line": "#313244",
    "minimap-mask": "rgba(30, 30, 46, .85)",
    "session-accent-l": "74%",
    "session-edge-idle-l": "65%",
    "cat-file": "#89b4fa",
    "cat-shell": "#f9e2af",
    "cat-web": "#89dceb",
    "cat-agent": "#f5c2e7",
    "cat-task": "#a6e3a1",
    "cat-plan": "#cba6f7",
    "cat-mcp": "#94e2d5",
    "cat-other": "#bac2de",
    "usage-purple": "#cba6f7",
    "usage-blue": "#89b4fa",
    "usage-teal": "#94e2d5",
    "usage-lime": "#a6e3a1",
    "usage-pink": "#f5c2e7",
    "usage-indigo": "#b4befe",
    "usage-orange": "#fab387",
    "usage-zinc": "#bac2de",
    "usage-cyan": "#89dceb"
  },
  "selection": {
    "background": "#45475a",
    "foreground": "#cdd6f4"
  }
}
