{
  "$schema": "./schema.json",
  "schemaVersion": 1,
  "id": "rider-black",
  "name": "Rider Black",
  "colorScheme": "dark",
  "order": 30,
  "extends": "dark",
  "tokens": {
    "bg": "#1e1f22",
    "bg-soft": "#25262a",
    "panel": "#2b2d30",
    "line": "#393b40",
    "line-soft": "#333539",
    "text": "#dfe1e5",
    "text-secondary": "#b4b8bf",
    "muted": "#a3a6ae",
    "text-dim": "#9da0a8",
    "muted-dim": "#72767d",
    "ctl-fill": "color-mix(in srgb, var(--text) 8%, transparent)",
    "accent": "#83acfc",
    "accent-dim": "#3574f050",
    "ok": "#89cc8e",
    "warn": "#f2c55c",
    "err": "#eb938d",
    "chrome-bg": "#2b2d30",
    "chrome-edge": "#43454a",
    "node-grad": "var(--panel)",
    "topbar-grad": "var(--panel)",
    "conn-wash": "#eb938d18",
    "burst-live-wash": "#f0abfc12",
    "hero-core": "#83acfc",
    "grid-line": "#303237",
    "minimap-mask": "rgba(30, 31, 34, .85)",
    "session-accent-l": "74%",
    "session-edge-idle-l": "65%"
  },
  "selection": {
    "background": "#2e436e",
    "foreground": "#dfe1e5"
  }
}
